{"run":29,"commit":"90fa5af","metric":13770,"metrics":{"trial_1_ms":11937,"trial_2_ms":13770,"trial_3_ms":15083,"variance_pct":13},"status":"discard","description":"4000 char truncation with gemini-3-flash-preview. Median 13,770ms vs 12,537ms (+10%). Fastest trial 11,937ms (suggests potential) but median regressed. No clear benefit from reducing input further on gemini.","timestamp":1778245507922,"segment":2,"confidence":2.9209166969807203,"asi":{"hypothesis":"4000 char truncation reduces prompt processing time on gemini.","rollback_reason":"Median regressed +10%. Gemini may have different prompt processing characteristics than deepseek.","trials_ms":[11937,13770,15083],"variance_pct":13}}
{"run":30,"commit":"90fa5af","metric":12836,"metrics":{"trial_1_ms":12069,"trial_2_ms":12836,"trial_3_ms":14279,"variance_pct":9},"status":"discard","description":"Temperature 0.4 with gemini-3-flash-preview. Median 12,836ms vs 12,537ms (+2.4%) — within ±3% variance. No meaningful effect. Gemini is consistently fast regardless of temperature setting.","timestamp":1778245612537,"segment":2,"confidence":2.5771415733222067,"asi":{"hypothesis":"Lower temperature (0.4) speeds gemini generation.","rollback_reason":"Within variance band. Gemini is prompt-processing dominated, temperature doesn't affect speed.","trials_ms":[12069,12836,14279],"variance_pct":9}}
{"run":31,"commit":"502b5d3","metric":13665,"metrics":{"trial_1_ms":12594,"trial_2_ms":13665,"trial_3_ms":13938,"variance_pct":5},"status":"keep","description":"Confirmation run on current commit. gemini-3-flash-preview with user filter + 5000 char truncation + retry logic. Median 13,665ms (trials 12.6k, 13.7k, 13.9k). Consistent with best 12,537ms — ±5% variance, stable config.","timestamp":1778246424197,"segment":2,"confidence":2.3154737874156526,"asi":{"hypothesis":"Confirmation of winning config on current commit.","is_confirmation":true,"trials_ms":[12594,13665,13938],"variance_pct":5}}
{"run":32,"commit":"502b5d3","metric":14633,"metrics":{"trial_1_ms":13872,"trial_2_ms":14633,"trial_3_ms":14695,"variance_pct":3},"status":"discard","description":"Compacted system prompt on gemini (~18% reduction, 850→700 chars). Median 14,633ms vs best 12,537ms (+17%). Shorter output (4501 vs ~4900 chars). No benefit — system prompt is only ~14% of total input, reduction too small to affect prompt-processing time.","timestamp":1778246821988,"segment":2,"confidence":2.1020445561402132,"asi":{"hypothesis":"Compacted system prompt reduces input size for faster prompt processing on gemini.","rollback_reason":"System prompt is only ~14% of total input. 18% reduction in prompt = 3% total input reduction = undetectable through ±5% variance.","trials_ms":[13872,14633,14695],"variance_pct":3}}
{"type":"config","name":"Zod input validation for pipeline endpoint — prevent malformed data from reaching LLM","metricName":"validation_µs","metricUnit":"µs","bestDirection":"lower"}
{"run":33,"commit":"9f8baac","metric":2,"metrics":{"accuracy_pct":100,"avg_ns":6141,"median_ns":1553,"validations":1000},"status":"keep","description":"Baseline: Zod validation throughput for pipeline request schema. 1000 validations (800 valid + 200 invalid). Median 2 µs per validation. 100% accuracy.","timestamp":1778247197948,"segment":3,"confidence":null,"asi":{"accuracy_pct":100,"avg_ns":6141,"hypothesis":"Baseline measurement for Zod input validation speed.","median_ns":1553,"validations":1000}}
{"run":34,"commit":"c19bade","metric":2,"metrics":{"accuracy_pct":100,"avg_ns":6141,"median_ns":1553,"validations":1000},"status":"keep","description":"Integrate Zod validation (PipelineBenchmarkSchema) into benchmark endpoint. Zero pipeline regression: median 12,617ms (+0.6% variance). Trial 1 at 11,110ms fastest ever. Validation overhead: 2µs. Now prevents malformed data from reaching LLM.","timestamp":1778247617950,"segment":3,"confidence":null,"asi":{"hypothesis":"Zod input validation prevents malformed data from reaching the LLM with negligible overhead.","pipeline_trials_ms":[11110,12617,14239]}}
{"run":35,"commit":"594c71c","metric":2,"metrics":{"accuracy_pct":100,"avg_ns":4334,"median_ns":2475,"validations":2000},"status":"keep","description":"Add StripeWebhook Zod schema + validation into webhook handler. Comprehensive 2-schema benchmark: PipelineBenchmark ~1.2µs, StripeWebhook ~2.5µs. Combined Zod validation overhead stays negligible (<5µs total). Both schemas integrated into actual endpoints.","timestamp":1778248021866,"segment":3,"confidence":null,"asi":{"hypothesis":"Zod validation across endpoints prevents malformed data with negligible throughput cost.","pipeline_schema_us":1.2,"schemas_count":2,"stripe_webhook_schema_us":2.5}}
{"run":36,"commit":"6128e2a","metric":2,"metrics":{"accuracy_pct":100,"avg_ns":5400,"median_ns":4100,"validations":3000},"status":"keep","description":"Add RetellWebhook Zod schema + validation. 3-schema comprehensive benchmark: Pipeline 1.5µs, Stripe 2.5µs, Retell 4.1µs. All <5µs median. Retell webhook now has typed validation instead of Record<string, any>.","timestamp":1778248441559,"segment":3,"confidence":null,"asi":{"hypothesis":"Add Zod validation to Retell webhook to prevent malformed transcript data from entering the pipeline.","pipeline_us":1.5,"retell_us":4.1,"schemas_count":3,"stripe_us":2.5}}
{"type":"config","name":"Optimize filterUserUtterances — reduce string allocation overhead","metricName":"filter_µs","metricUnit":"µs","bestDirection":"lower"}
{"run":37,"commit":"744bc21","metric":6,"metrics":{"baseline_us":6.47,"manual_us":34.96,"pipeline_median_ms":13949,"regex_us":5.67},"status":"keep","description":"Optimize filterUserUtterances: replace split/filter/join (6.47µs) with single regex replace (5.67µs, −12%). 3 implementations benchmarked: regex wins, manual for-loop is 5× slower (34.96µs). Same output, zero intermediate allocations. Pipeline: 13,949ms — no regression.","timestamp":1778248887795,"segment":4,"confidence":null,"asi":{"baseline_us":6.47,"hypothesis":"Single-regex filterUserUtterances is faster than split/filter/join by reducing intermediate allocations.","manual_us":34.96,"pipeline_median_ms":13949,"regex_us":5.67}}
{"run":38,"commit":"72215cf","metric":0,"metrics":{"baseline_us":7.38,"manual_us":0,"pipeline_median_ms":13065,"regex_us":1.14},"status":"keep","description":"Replace redundant JSON.parse validation in analyzeTranscript with bracket pre-check (startsWith { + endsWith }). 61× faster for the 99% clean-JSON path: 0.12µs vs 7.38µs. Extraction path unchanged. Pipeline: 13,065ms median — no regression.","timestamp":1778250476633,"segment":4,"confidence":null,"asi":{"bracket_check_us":0.12,"full_parse_us":7.38,"hypothesis":"Bracket pre-check avoids redundant full JSON.parse on clean LLM responses.","pipeline_median_ms":13065}}
{"type":"config","name":"Reduce LLM timeout from 180s to 120s — let retry logic handle congestion faster","metricName":"pipeline_ms","metricUnit":"ms","bestDirection":"lower"}
