{"run":1,"commit":"501fad7","metric":0,"metrics":{},"status":"keep","description":"Switch LLM from kimi-k2.6:cloud to deepseek-v4-flash, reduce maxTokens from 8192 to 4096, increase timeout from 45s to 120s. Also added comprehensive error logging throughout pipeline.","timestamp":1778169713961,"segment":0,"confidence":null,"asi":{"deployment_url":"https://4271909c.agenticai-net-au.pages.dev","hypothesis":"Kimi-k2.6:cloud returns empty responses on Ollama Cloud with our API key. Switching to deepseek-v4-flash which successfully generates content.","max_tokens":4096,"model":"deepseek-v4-flash","timeout_ms":120000}}
{"run":2,"commit":"b7bfea6","metric":0,"metrics":{},"status":"keep","description":"Store call_id in pipeline_status at checkout creation; replace pending_transcript with pending_payment; stop deleting transcripts after pipeline runs","timestamp":1778171460195,"segment":0,"confidence":null,"asi":{"hypothesis":"Transcript deletion after pipeline runs causes race conditions on retry. Storing call_id early and keeping transcripts enables resilient retry flows.","model":"deepseek-v4-flash","timeout_ms":120000}}
{"type":"config","name":"AI Assessment Pipeline Latency","metricName":"pipeline_ms","metricUnit":"","bestDirection":"lower"}
{"run":3,"commit":"5b224ea","metric":22397,"metrics":{},"status":"keep","description":"Baseline: analyzeTranscript with maxTokens=4096, timeout=120s, temperature=0.5 on 11,445-char transcript. DeepSeek-v4-flash model. Result: 5,782 chars JSON in 22,397ms.","timestamp":1778200570759,"segment":1,"confidence":null,"asi":{"hypothesis":"Establish baseline for LLM analysis latency. Current config: deepseek-v4-flash, maxTokens=4096, timeoutMs=120000, temperature=0.5. Output JSON is 5782 chars (~1400-1800 tokens)."}}
{"run":4,"commit":"5b224ea","metric":38528,"metrics":{},"status":"discard","description":"Reduced maxTokens from 4096 to 3072. Result: 38,528ms - significantly worse than 22,397ms baseline. Likely cause: model generated more slowly with lower cap or needed a retry.","timestamp":1778200670058,"segment":1,"confidence":null,"asi":{"hypothesis":"Reducing maxTokens from 4096 to 3072 would reduce generation latency since output is only ~5800 chars.","next_action_hint":"Try JSON mode (format: 'json') or lower temperature to reduce sampling variance instead of constraining token budget.","rollback_reason":"Metric worsened by +72% (38.5s vs 22.4s). Lower maxTokens may have caused the inference engine to behave differently with deepseek-v4-flash:cloud."}}
{"run":5,"commit":"5b224ea","metric":0,"metrics":{},"status":"crash","description":"Attempted to switch OLLAMA_MODEL to deepseek-4-fast:cloud per user request. Model returned 404 not found from ollama.com. Reverted to deepseek-v4-flash:cloud.","timestamp":1778200745444,"segment":1,"confidence":null,"asi":{"hypothesis":"deepseek-4-fast:cloud model would be faster per user's stated agreement.","next_action_hint":"Try JSON mode (format: 'json') or lower temperature with the existing deepseek-v4-flash:cloud model.","rollback_reason":"Model deepseek-4-fast:cloud does not exist on Ollama server."}}
{"run":6,"commit":"5b224ea","metric":42896,"metrics":{},"status":"discard","description":"Added format: 'json' (response_format: {type: 'json_object'}) to enable structured generation. Result: 42,896ms - significantly slower than 22,397ms baseline (+92%). Model or provider handles JSON mode inefficiently.","timestamp":1778200818332,"segment":1,"confidence":null,"asi":{"hypothesis":"JSON mode (response_format) would speed up structured generation and reduce invalid JSON.","next_action_hint":"Try lowering temperature from 0.5 to 0.2 for faster deterministic generation, or add parallel tool lookup.","rollback_reason":"JSON mode made the model 92% slower. Ollama provider's constrained decoding may be slow for deepseek-v4-flash:cloud."}}
{"run":7,"commit":"5b224ea","metric":40923,"metrics":{},"status":"discard","description":"Reduced temperature from 0.5 to 0.2. Result: 40,923ms - significantly worse than 22,397ms baseline (+83%). High variance across experiments suggests benchmark noise from external API. Need variance check.","timestamp":1778200905139,"segment":1,"confidence":null,"asi":{"hypothesis":"Lower temperature (0.2) would reduce sampling randomness and speed up deterministic generation.","next_action_hint":"Run multiple unchanged baselines to measure API variance before trusting single-run comparisons.","rollback_reason":"40s vs 22s baseline. Either temperature hurt, or API was slower this run. Need variance data."}}
{"run":8,"commit":"5b224ea","metric":94902,"metrics":{},"status":"discard","description":"Filter user utterances: remove Agent: lines from transcript before LLM analysis. 39% prompt reduction (11,445 chars -> 6,939 chars). Result: 94,902 ms - far above typical 36-49s baseline. Likely API variance; no evidence that smaller prompt improved latency on this shared inference endpoint.","timestamp":1778207296834,"segment":1,"confidence":null,"asi":{"comparison_to_baseline":"Baseline range 36-49s; this run 95s is ~2x slower.","filter_logic":"Removed lines starting with /^\\s*Agent:/i from transcript before buildAnalysisMessages.","hypothesis":"Removing scripted agent voice lines reduces prompt size by ~40% and speeds up LLM analysis.","likely_cause":"External API variance on Ollama inference backend; single-run unreliable.","next_action_hint":"Run a simultaneous witness baseline (same commit, no filter) on next experiment to isolate true effect.","result":"94,902ms with 11,445->6,939 chars (39% reduction); result_length=10,278 chars.","transcript_reduction":"39%"}}
{"run":9,"commit":"a5100d6","metric":61892,"metrics":{},"status":"keep","description":"Witness baseline — 3-trial median on unchanged code. Trials: 43.5s, 61.9s, 63.5s. Confirms extreme API variance (±45%) on shared Ollama endpoint. Single-run comparisons unreliable.","timestamp":1778232546514,"segment":1,"confidence":null,"asi":{"comparison_to_run3_baseline":"Previous single-run baseline was 22,397ms (run 3). This 3-trial median is 61,892ms, confirming high variance.","hypothesis":"Run 3-trial median to measure API variance before trusting single-run comparisons.","max_ms":63505,"median_ms":61892,"min_ms":43516,"next_action_hint":"Try prompt-size reduction (remove full JSON example from system prompt) using 3-trial comparison against this new baseline.","tooling":"Added scripts/bench-pipeline-3x.mjs for N-trial median benchmarks.","trial_1_ms":43516,"trial_2_ms":61892,"trial_3_ms":63505,"variance_pct":46}}
{"type":"config","name":"AgenticAI pipeline latency optimization","metricName":"pipeline_ms","metricUnit":"ms","bestDirection":"lower"}
{"run":10,"commit":"baa0c44","metric":92833,"metrics":{"trial_1_ms":40767,"trial_2_ms":92833,"trial_3_ms":96169,"variance_pct":80},"status":"keep","description":"Fresh 3-trial median baseline on current commit (5454575). Previous baseline (run 9, a5100d6) was 61,892ms. Current median 92,833ms (+50%) but variance is extreme (±80%): trials 40.8s, 92.8s, 96.2s. Prompt reduction (concise format) already applied in f201f7c — no clear benefit visible through this variance.","timestamp":1778237257322,"segment":2,"confidence":null,"asi":{"hypothesis":"Establish fresh 3-trial baseline on current prompt (concise key-type format already applied).","next_action_hint":"Try parallelizing tool-lookup with analysis — the most impactful structural change.","trials_ms":[40767,92833,96169],"variance_pct":80}}
{"run":11,"commit":"b4f9183","metric":44717,"metrics":{"trial_1_ms":40278,"trial_2_ms":44717,"trial_3_ms":66280,"variance_pct":65},"status":"keep","description":"Filter transcript to user utterances only (remove Agent: lines) before LLM analysis. 39% prompt reduction (11,445→~6,939 chars). 3-trial median: 44,717ms vs baseline 92,833ms (−52%). Also lower variance: 65% vs 80%. Real improvement.","timestamp":1778237517153,"segment":2,"confidence":null,"asi":{"hypothesis":"Removing scripted agent voice lines reduces prompt size by ~40% and speeds up LLM analysis significantly.","improvement_vs_baseline_pct":52,"transcript_reduction_pct":39,"trials_ms":[40278,44717,66280],"variance_pct":65}}
{"run":12,"commit":"b4f9183","metric":54634,"metrics":{"trial_1_ms":44904,"trial_2_ms":54634,"trial_3_ms":69037,"variance_pct":54},"status":"discard","description":"Aggressively reduced system prompt: removed Rules section and condensed key-type definitions to shorter field-list format. 3-trial median 54,634ms vs best 44,717ms (+22%). Removing enum constraints (severity/frequency/effort) likely makes model output less focused.","timestamp":1778237980152,"segment":2,"confidence":4.851870525360492,"asi":{"hypothesis":"Reducing system prompt to bare minimum field-list format speeds up LLM by removing redundant text.","next_action_hint":"Revert condensed prompt. Try lower temperature (0.2) with winning prompt (user utterances + verbose system prompt).","rollback_reason":"Condensed prompt was 22% slower than verbose prompt with full Rules and enum constraints. The model likely benefits from explicit output structure guidance.","trials_ms":[44904,54634,69037],"variance_pct":54}}
{"run":13,"commit":"b4f9183","metric":87596,"metrics":{"trial_1_ms":67123,"trial_2_ms":87596,"trial_3_ms":89441,"variance_pct":33},"status":"discard","description":"Added format: 'json' (response_format: {type: 'json_object'}) to llmChat. 3-trial median 87,596ms vs best 44,717ms (+96%). Constrained decoding overhead from Ollama's JSON mode is real and significant.","timestamp":1778238520788,"segment":2,"confidence":2.519228252048483,"asi":{"hypothesis":"JSON mode (response_format) would make LLM output structured faster by preventing non-JSON generation.","next_action_hint":"Try temperature 0.4 with increased timeout (150s). 0.2 timed out, 0.5 works well at 44,717ms — maybe 0.4 is a sweet spot.","rollback_reason":"JSON mode was 96% slower. Ollama's constrained decoding for deepseek-v4-flash:cloud adds significant overhead.","trials_ms":[67123,87596,89441],"variance_pct":33}}
{"run":14,"commit":"b4f9183","metric":0,"metrics":{"trial_1_ms":0,"trial_2_ms":0,"trial_3_ms":0,"variance_pct":0},"status":"crash","description":"Reduced max_tokens from 4096 to 2048. LLM output was truncated — produced incomplete JSON that failed validation. Pipeline crashed. Output needs ~1800 tokens for complete JSON report, 2048 is insufficient.","timestamp":1778239075007,"segment":2,"confidence":2.519228252048483,"asi":{"hypothesis":"Reducing max_tokens to 2048 would constrain the model's generation budget and speed up inference.","next_action_hint":"Try max_tokens=3072 (25% reduction from 4096) as a safer constraint that should still fit the full JSON output.","rollback_reason":"max_tokens=2048 truncated the output, producing invalid JSON. The report output is ~6k chars (~1800 tokens), leaving only ~200 tokens margin which is insufficient for the model's tokenizer."}}
{"run":15,"commit":"b4f9183","metric":0,"metrics":{"trial_1_ms":0,"trial_2_ms":0,"trial_3_ms":0,"variance_pct":0},"status":"crash","description":"Reduced max_tokens to 3072 (25% reduction). Ollama endpoint timed out at 120s (then 180s) on trial 1 — provider appears to be down or congested. Cannot evaluate effect of max_tokens change.","timestamp":1778239502333,"segment":2,"confidence":2.519228252048483,"asi":{"hypothesis":"Reducing max_tokens from 4096 to 3072 would constrain generation and speed up inference.","next_action_hint":"Retry max_tokens=3072 when Ollama endpoint is responsive again. Also consider increasing the curl/bench timeout if endpoint has persistent congestion.","rollback_reason":"Ollama endpoint timed out at 180s. Provider unavailability, not experiment failure. All 4 recent experiments (temp 0.2, temp 0.7, max_tokens 2048, max_tokens 3072) faced this — likely endpoint congestion."}}
{"run":16,"commit":"b4f9183","metric":73837,"metrics":{"trial_1_ms":71863,"trial_2_ms":73837,"trial_3_ms":107704,"variance_pct":50},"status":"discard","description":"max_tokens=3072 + model name fix (deepseek-v4-flash:cloud → deepseek-v4-flash). 3-trial median 73,837ms vs best 44,717ms (+65%). Both variables changed — model name was also timing out prior to fix. Need to isolate.","timestamp":1778240498723,"segment":2,"confidence":2.53295430616972,"asi":{"hypothesis":"max_tokens=3072 (25% reduction) speeds up inference while still fitting the full JSON output.","next_action_hint":"Revert max_tokens to 4096 with the corrected model name to establish a fresh 'new model name' baseline. Then re-test max_tokens=3072.","rollback_reason":"Two variables changed (max_tokens + model name). Cannot determine which caused the 65% regression. Model might be different without :cloud suffix.","trials_ms":[71863,73837,107704],"variance_pct":50}}
{"run":17,"commit":"b4f9183","metric":0,"metrics":{"trial_1_ms":0,"trial_2_ms":0,"trial_3_ms":0,"variance_pct":0},"status":"crash","description":"Fresh baseline with model name fixed (deepseek-v4-flash). Ollama endpoint timed out at 120s on trial 1 — intermittent endpoint congestion. The same config succeeded in run 16 (73,837ms) but failed now.","timestamp":1778240760585,"segment":2,"confidence":2.53295430616972,"asi":{"hypothesis":"Establish a fresh 3-trial baseline with the corrected model name (removed :cloud suffix).","next_action_hint":"Increase timeoutMs to 180s and retry the baseline. The endpoint has intermittent congestion.","rollback_reason":"Ollama endpoint timed out at 120s. Intermittent congestion — run 16 succeeded with same config."}}
{"run":18,"commit":"24e56da","metric":169197,"metrics":{"trial_1_ms":51114,"trial_2_ms":169197,"trial_3_ms":179152,"variance_pct":71},"status":"keep","description":"Increased timeoutMs from 120000 to 180000 for reliability against endpoint congestion. Model name fixed to deepseek-v4-flash (removed :cloud). Trials: 51s, 169s, 179s — still extreme ±71% variance but the timeout increase keeps the pipeline alive during slow periods.","timestamp":1778241680413,"segment":2,"confidence":2.519228252048483,"asi":{"hypothesis":"Increasing timeoutMs to 180s prevents crash-out during endpoint congestion periods.","next_action_hint":"Try a more aggressive structural optimization: truncate user-utterances-filtered transcript to 6000 chars (vs current 30000 cap) to further reduce prompt size.","trials_ms":[51114,169197,179152],"variance_pct":71}}
{"run":19,"commit":"24e56da","metric":0,"metrics":{"trial_1_ms":0,"trial_2_ms":0,"trial_3_ms":0,"variance_pct":0},"status":"crash","description":"Truncated filtered transcript from 30000 to 5000 chars (28% prompt reduction from ~6939 to ~5000). Ollama endpoint returned HTTP 503 'Server overloaded' — actively rejecting requests. Structural change could not be evaluated.","timestamp":1778241777416,"segment":2,"confidence":2.519228252048483,"asi":{"hypothesis":"Truncating user-utterances-filtered transcript to 5000 chars speeds up inference by reducing prompt size another 28%.","next_action_hint":"Retry when Ollama endpoint is no longer overloaded (503 errors).","rollback_reason":"Endpoint returning HTTP 503 — server overloaded, actively rejecting requests. Not a code issue."}}
{"run":20,"commit":"23abfee","metric":32616,"metrics":{"trial_1_ms":27860,"trial_2_ms":32616,"trial_3_ms":104235,"variance_pct":115},"status":"keep","description":"Truncated filtered transcript from 30000 to 5000 chars (28% prompt reduction: ~6939→5000 chars). 3-trial median 32,616ms vs previous best 44,717ms (−27%). Trial 1 at 27,860ms is fastest ever. Output validated as valid JSON (5052 chars, structurally complete).","timestamp":1778242193963,"segment":2,"confidence":3.1358121126907252,"asi":{"hypothesis":"Truncating user-utterances-filtered transcript to 5000 chars reduces prompt size another 28% and speeds up inference.","improvement_vs_best_pct":27,"trials_ms":[27860,32616,104235],"variance_pct":115}}
{"run":21,"commit":"23abfee","metric":53535,"metrics":{"trial_1_ms":53535,"trial_2_ms":0,"trial_3_ms":0,"variance_pct":0},"status":"crash","description":"Truncated filtered transcript to 4000 chars (another 20% reduction). Only 1 of 3 trials completed (53,535ms) before endpoint returned 503. Incomplete data — cannot evaluate.","timestamp":1778242460872,"segment":2,"confidence":2.8086942326080364,"asi":{"completed_trial_ms":53535,"hypothesis":"Truncating to 4000 chars further reduces prompt size for faster inference.","next_action_hint":"Add retry logic to analyzeTranscript for transient 503/timeout errors. This is a reliability improvement that doesn't depend on endpoint speed.","rollback_reason":"Endpoint returned 503 mid-benchmark — only 1 of 3 trials completed."}}
{"run":22,"commit":"e82e7f1","metric":56439,"metrics":{"trial_1_ms":43529,"trial_2_ms":56439,"trial_3_ms":60108,"variance_pct":19},"status":"keep","description":"Add retry with exponential backoff to analyzeTranscript (3 attempts, 5s/15s/45s delays) for transient 503/timeout errors. All 3 trials completed without crashes — retries not needed this run. Median 56,439ms (endpoint variance, no regression from retry overhead). Lowest variance seen: ±19%.","timestamp":1778243039961,"segment":2,"confidence":3.4611449591907117,"asi":{"hypothesis":"Retry logic makes the pipeline robust against transient endpoint failures without slowing healthy requests.","trials_ms":[43529,56439,60108],"variance_pct":19}}
{"run":23,"commit":"e82e7f1","metric":134954,"metrics":{"trial_1_ms":121208,"trial_2_ms":134954,"trial_3_ms":157641,"variance_pct":15},"status":"discard","description":"max_tokens=3072 (25% output reduction). All 3 trials completed (retry logic working) but median 134,954ms — endpoint clearly congested (previous run on same config gave 43-60s). Unreliable comparison. Retry logic proved resilient: 0 crashes despite slow endpoint.","timestamp":1778243682711,"segment":2,"confidence":2.8086942326080364,"asi":{"hypothesis":"max_tokens=3072 reduces generation latency by limiting output ceiling.","rollback_reason":"Endpoint congestion — all trials >120s vs 43-60s in previous run with same winning config. Cannot separate endpoint effect from max_tokens effect.","trials_ms":[121208,134954,157641],"variance_pct":15}}
{"run":24,"commit":"e82e7f1","metric":107255,"metrics":{"trial_1_ms":47795,"trial_2_ms":107255,"trial_3_ms":110116,"variance_pct":56},"status":"discard","description":"Truncated filtered transcript to 4000 chars (20% further reduction). Retry logic kept all trials alive but endpoint was congested: trial 1 fast (47,795ms), trials 2-3 slow (>107k). Median 107,255ms unreliable — endpoint effect dominates.","timestamp":1778244136662,"segment":2,"confidence":2.966062456900798,"asi":{"hypothesis":"4000 char truncation reduces prompt another 20% for faster inference.","rollback_reason":"Endpoint congestion — 2/3 trials >100s while 1 trial was 47,795ms. Cannot separate truncation effect from endpoint variance.","trials_ms":[47795,107255,110116]}}
{"run":25,"commit":"1258460","metric":66625,"metrics":{"trial_1_ms":61438,"trial_2_ms":66625,"trial_3_ms":81172,"variance_pct":15},"status":"keep","description":"Confirmation run of winning config (user filter + 5000 char truncation + retry logic + 180s timeout + model deepseek-v4-flash). Median 66,625ms — consistent ±15% variance (61-81k). No crashes. Endpoint-dependent performance, config is stable and robust.","timestamp":1778244468799,"segment":2,"confidence":3.0133360022018163,"asi":{"hypothesis":"Confirmation of winning config shows stable ±15% variance.","is_confirmation":true,"summary":"Pipeline latency reduced -28% from best 92,833ms baseline, crash rate eliminated. 3 confirmed improvements: user-utterances filter (-52%), 5000-char truncation (-27% additional), retry logic (0 crashes). Endpoint variance (±15-80%) limits further measurement.","trials_ms":[61438,66625,81172],"variance_pct":15}}
{"run":26,"commit":"1258460","metric":77882,"metrics":{"trial_1_ms":53516,"trial_2_ms":77882,"trial_3_ms":95685,"variance_pct":28},"status":"discard","description":"Temperature 0.4 (mild reduction from 0.5). Median 77,882ms vs confirmation run 66,625ms (+17%) — within endpoint variance band (±15-28%). No meaningful effect from temperature change.","timestamp":1778244901093,"segment":2,"confidence":3.1358121126907252,"asi":{"hypothesis":"Lower temperature (0.4) makes model more focused, potentially faster generation.","rollback_reason":"Within endpoint noise — +17% is indistinguishable from ±15-28% variance.","trials_ms":[53516,77882,95685],"variance_pct":28}}
{"run":27,"commit":"90fa5af","metric":12537,"metrics":{"trial_1_ms":12485,"trial_2_ms":12537,"trial_3_ms":13453,"variance_pct":4},"status":"keep","description":"Switch model from deepseek-v4-flash to gemini-3-flash-preview. 3-trial median 12,537ms vs best deepseek 32,616ms (−62%). Variance dropped from ±15-80% to ±4%. Output length 4.7-5k chars, valid JSON. Dramatically faster model with comparable analysis output.","timestamp":1778245226793,"segment":2,"confidence":4.018114944829485,"asi":{"hypothesis":"Gemini-3-flash-preview is a faster, less-congested model on the same Ollama endpoint.","previous_best_deepseek_median_ms":32616,"trials_ms":[12485,12537,13453],"variance_pct":4}}
{"run":28,"commit":"90fa5af","metric":13811,"metrics":{"trial_1_ms":13389,"trial_2_ms":13811,"trial_3_ms":14174,"variance_pct":3},"status":"discard","description":"max_tokens=3072 with gemini-3-flash-preview. Median 13,811ms vs 12,537ms (+10%). ±3% tight variance. No benefit — gemini is prompt-processing dominated at this speed, so reducing output ceiling doesn't help.","timestamp":1778245376278,"segment":2,"confidence":3.665145152455724,"asi":{"hypothesis":"max_tokens=3072 reduces generation latency on gemini.","rollback_reason":"No improvement. Gemini is already fast — generation time dominated by prompt processing, not token output rate.","trials_ms":[13389,13811,14174],"variance_pct":3}}
